{
  "id": "A01",
  "kind": "revise_anchors",
  "origin": {
    "trigger": "debrief_handoff",
    "source_unit": "U01",
    "source_ref": "units/U01/debrief.json handoff_notes"
  },
  "rationale": "Human-gated anchor revision recorded as a revise_anchors amendment (GV-12).",
  "scope_change": false,
  "human_gate": true,
  "list": "non_goals",
  "revise_ops": [
    {
      "op": "edit",
      "item": "NG-1b",
      "prior_text": "NG-1"
    }
  ],
  "fuel_cost": 1,
  "fuel_before": 1,
  "fuel_after": 0,
  "frontier_wave": 2,
  "graph_revision_after": 2,
  "timestamp": "2026-07-18T12:30:00-0400",
  "transcript_ref": "p7-U01-1"
}