{
  "id": "A01",
  "kind": "add_units",
  "origin": {
    "trigger": "debrief_handoff",
    "source_unit": "U03",
    "source_ref": "units/U03/debrief.json handoff_notes: 'we also need a migration-safety check'"
  },
  "rationale": "U03's debrief surfaced a migration-safety check absent from the original plan; add a dedicated unit. Mechanical addition that traces verbatim to an existing Definition-of-Done item, so it is autonomous (no scope change) and consumes 1 fuel. || COMMENTED revise_anchors VARIANT beside this add_units example (a SEPARATE amendment record — kept as an INERT string so this file stays a single SC5-valid `add_units` object; copy the JSON object after the colon and save it as its own amendments/A<NN>.json): {\"id\":\"A02\",\"kind\":\"revise_anchors\",\"origin\":{\"trigger\":\"p7_resolution\",\"source_unit\":\"U04\",\"source_ref\":\"DECISIONS.md#d-12 (P7 gate revised a DoD anchor after new evidence)\"},\"rationale\":\"P7 human gate revised a Definition-of-Done anchor after new evidence; recorded as a bounded anchor edit, not smuggled inside a growth kind (GP-4).\",\"scope_change\":true,\"human_gate\":true,\"list\":\"definition_of_done\",\"revise_ops\":[{\"op\":\"edit\",\"item\":\"All new schema properties are additive/optional, version-gated where requiredness applies.\",\"prior_text\":\"All new schema properties are additive/optional.\"}],\"transcript_ref\":\"dialogues.json p7-U04-1\",\"propagation_targets\":[\"U05\",\"U06\"],\"propagation\":\"remaining-scope-none\",\"fuel_cost\":1,\"fuel_before\":7,\"fuel_after\":6,\"graph_revision_after\":3,\"timestamp\":\"2026-07-18T12:00:00-0400\"} (revise_anchors closure: requires revise_ops+list; FORBIDS units_added/units_retired; human_gate==true unconditionality is an I19 predicate, GV-13.)",
  "scope_change": false,
  "human_gate": false,
  "dod_refs": ["the migration path is verified safe by a dedicated check"],
  "fuel_cost": 1,
  "fuel_before": 8,
  "fuel_after": 7,
  "frontier_wave": 3,
  "units_added": ["U07"],
  "graph_revision_after": 2,
  "timestamp": "2026-07-10T14:00:00-0400"
}
